{"schema": "klm-attestation/0.1", "inference": {"id": "hive_finding_f1", "timestamp": "2024-10-27T03:33:20Z", "model": {"identifier": "nage-hive-min", "version": "0.2.0"}}, "knowledge_contributions": [{"id": "ku_trace_0", "content": "Corroborating trace t_0", "origin": "injected", "function": "declarative", "source_reference": "hive://trace/t_0", "source_class": "tool_result", "lifecycle": "active", "epistemic_status": "measured"}, {"id": "ku_trace_1", "content": "Corroborating trace t_1", "origin": "injected", "function": "declarative", "source_reference": "hive://trace/t_1", "source_class": "tool_result", "lifecycle": "active", "epistemic_status": "measured"}, {"id": "ku_trace_2", "content": "Corroborating trace t_2", "origin": "injected", "function": "declarative", "source_reference": "hive://trace/t_2", "source_class": "tool_result", "lifecycle": "active", "epistemic_status": "measured"}], "evidence": [], "claims": [], "procedures": [], "spans": [{"id": "sp_out", "start": 0, "end": 0}], "metacognition": {"declared_confidence": 0.875, "grounded_confidence": {"formula": "klm-grounded/1.0", "value": 0.916667, "components": {"evidence": 0.875, "coherence": 1.0}}, "gap": -0.041667, "signal_status": {"declared_confidence": "heuristic", "grounded_confidence": "measured"}}, "governance": {"engine": {"identifier": "hive-governance-deterministic", "version": "0.1.0"}, "policies": [{"id": "pol_traceability_unsupported", "version": "1.0", "jurisdiction": "EU", "effective_date": "2025-08-01", "source": "EU AI Act (2024/1689) Art. 13 \u2014 per-decision traceability"}, {"id": "pol_overconfidence_gap", "version": "1.0", "jurisdiction": null, "effective_date": null, "source": "KLM Spec \u00a77.1 \u2014 declared/grounded gap discipline"}, {"id": "pol_speculative_scope", "version": "1.0", "jurisdiction": null, "effective_date": null, "source": "KLM-Gamma-Unification D1 \u2014 SPECULATIVE label semantics"}, {"id": "pol_stigmergic_support", "version": "1.0", "jurisdiction": null, "effective_date": null, "source": "HIVE OS-4 \u2014 an accumulated finding's evidence must be at least its strongest corroborator"}], "assessments": [{"id": "ga_0_traceability_unsupported", "namespace": "regulatory", "policy_id": "pol_traceability_unsupported", "policy_version": "1.0", "status": "pass", "responsible_object": "sp_out", "evidence": "3 resolvable corroborating trace reference(s)", "epistemic_status": "measured"}, {"id": "ga_1_overconfidence_gap", "namespace": "safety", "policy_id": "pol_overconfidence_gap", "policy_version": "1.0", "status": "pass", "responsible_object": "sp_out", "evidence": "confidence_gap=-0.0417 (max +0.3)", "epistemic_status": "measured"}, {"id": "ga_2_speculative_scope", "namespace": "scope", "policy_id": "pol_speculative_scope", "policy_version": "1.0", "status": "pass", "responsible_object": "sp_out", "evidence": "epistemic_label=STABLE", "epistemic_status": "measured"}, {"id": "ga_3_stigmergic_support", "namespace": "scope", "policy_id": "pol_stigmergic_support", "policy_version": "1.0", "status": "pass", "responsible_object": "sp_out", "evidence": "accumulated evidence=0.8750 \u2265 strongest corroborator=0.5000", "epistemic_status": "measured"}]}, "gamma": {"schema": "klm-gamma/1.0", "label_formula": "klm-label/1.0", "evidence_score": 0.875, "freshness_score": null, "coherence_score": 1.0, "declared_confidence": 0.875, "grounded_confidence": {"formula": "klm-grounded/1.0", "value": 0.916667, "components": {"evidence": 0.875, "coherence": 1.0}}, "confidence_gap": -0.041667, "confidence": 0.875, "signal_status": {"evidence_score": "measured", "declared_confidence": "heuristic", "grounded_confidence": "measured", "coherence_score": "measured"}, "nulls": {"freshness_score": {"reason": "accumulation_does_not_propagate_trace_timestamps_in_stub"}}, "epistemic_label": "STABLE"}, "relations": [{"type": "derived_from", "from": "sp_out", "to": "ku_trace_0"}, {"type": "derived_from", "from": "sp_out", "to": "ku_trace_1"}, {"type": "derived_from", "from": "sp_out", "to": "ku_trace_2"}, {"type": "assessed_by", "from": "sp_out", "to": "ga_0_traceability_unsupported"}, {"type": "assessed_by", "from": "sp_out", "to": "ga_1_overconfidence_gap"}, {"type": "assessed_by", "from": "sp_out", "to": "ga_2_speculative_scope"}, {"type": "assessed_by", "from": "sp_out", "to": "ga_3_stigmergic_support"}], "nulls": {"claims": {"reason": "an_accumulated_finding_has_no_textual_response_to_decompose"}, "inference.configuration": {"reason": "stub_comb_captures_no_runtime_config"}}, "ext": {"klm_l1": {"retrieval_relevance": null, "claim_support": null, "evidence_coverage": null, "source_authority": null, "source_freshness": null, "formulas": {"claim_support": "klm-support-lexical/0.1", "aggregate": "klm-l1-aggregate/0.1"}, "signal_status": {"retrieval_relevance": "unavailable", "claim_support": "unavailable", "evidence_coverage": "unavailable", "source_authority": "unavailable", "source_freshness": "unavailable"}, "nulls": {"retrieval_relevance": {"reason": "stigmergic_accumulation_is_not_a_retrieval"}, "claim_support": {"reason": "no_evidence_content_to_score_against"}, "evidence_coverage": {"reason": "no_decomposed_claims"}, "source_authority": {"reason": "tool_result_class_recorded_on_the_knowledge_units"}, "source_freshness": {"reason": "trace_timestamps_not_propagated_in_stub"}}}}}
