{"schema": "klm-attestation/0.1", "inference": {"id": "axiom_commit_n_merged", "timestamp": "2024-10-27T03:33:20Z", "model": {"identifier": "nage-axiom-min", "version": "0.2.0"}}, "knowledge_contributions": [{"id": "ku_src_0", "content": "Source node n_a value", "origin": "injected", "function": "declarative", "source_reference": "axiom://node/n_a", "source_class": "tool_result", "lifecycle": "active", "epistemic_status": "measured"}, {"id": "ku_src_1", "content": "Source node n_b value", "origin": "injected", "function": "declarative", "source_reference": "axiom://node/n_b", "source_class": "tool_result", "lifecycle": "active", "epistemic_status": "measured"}], "evidence": [], "claims": [], "procedures": [], "spans": [{"id": "sp_out", "start": 0, "end": 0}], "metacognition": {"declared_confidence": 0.25, "grounded_confidence": {"formula": "klm-grounded/1.0", "value": 0.716667, "components": {"evidence": 0.9, "coherence": 0.35}}, "gap": -0.466667, "signal_status": {"declared_confidence": "heuristic", "grounded_confidence": "measured"}}, "governance": {"engine": {"identifier": "axiom-governance-deterministic", "version": "0.1.0"}, "policies": [{"id": "pol_traceability_unsupported", "version": "1.0", "jurisdiction": "EU", "effective_date": "2025-08-01", "source": "EU AI Act (2024/1689) Art. 13 \u2014 per-decision traceability"}, {"id": "pol_overconfidence_gap", "version": "1.0", "jurisdiction": null, "effective_date": null, "source": "KLM Spec \u00a77.1 \u2014 declared/grounded gap discipline"}, {"id": "pol_speculative_scope", "version": "1.0", "jurisdiction": null, "effective_date": null, "source": "KLM-Gamma-Unification D1 \u2014 SPECULATIVE label semantics"}, {"id": "pol_composition_integrity", "version": "1.0", "jurisdiction": null, "effective_date": null, "source": "AXIOM OS-4 \u2014 a derived value must not assert more confidence than its weakest source"}], "assessments": [{"id": "ga_0_traceability_unsupported", "namespace": "regulatory", "policy_id": "pol_traceability_unsupported", "policy_version": "1.0", "status": "pass", "responsible_object": "sp_out", "evidence": "2 resolvable source node reference(s)", "epistemic_status": "measured"}, {"id": "ga_1_overconfidence_gap", "namespace": "safety", "policy_id": "pol_overconfidence_gap", "policy_version": "1.0", "status": "pass", "responsible_object": "sp_out", "evidence": "confidence_gap=-0.4667 (max +0.3)", "epistemic_status": "measured"}, {"id": "ga_2_speculative_scope", "namespace": "scope", "policy_id": "pol_speculative_scope", "policy_version": "1.0", "status": "pass", "responsible_object": "sp_out", "evidence": "epistemic_label=CONTESTED", "epistemic_status": "measured"}, {"id": "ga_3_composition_integrity", "namespace": "scope", "policy_id": "pol_composition_integrity", "policy_version": "1.0", "status": "pass", "responsible_object": "sp_out", "evidence": "declared=0.2500 \u2264 min(source declared)=0.2500 via MERGE", "epistemic_status": "measured"}]}, "gamma": {"schema": "klm-gamma/1.0", "label_formula": "klm-label/1.0", "evidence_score": 0.9, "freshness_score": null, "coherence_score": 0.35, "declared_confidence": 0.25, "grounded_confidence": {"formula": "klm-grounded/1.0", "value": 0.716667, "components": {"evidence": 0.9, "coherence": 0.35}}, "confidence_gap": -0.466667, "confidence": 0.25, "signal_status": {"evidence_score": "measured", "declared_confidence": "heuristic", "grounded_confidence": "measured", "coherence_score": "measured"}, "nulls": {"freshness_score": {"reason": "composition_does_not_propagate_input_timestamps_in_stub"}}, "epistemic_label": "CONTESTED"}, "relations": [{"type": "derived_from", "from": "sp_out", "to": "ku_src_0"}, {"type": "derived_from", "from": "sp_out", "to": "ku_src_1"}, {"type": "assessed_by", "from": "sp_out", "to": "ga_0_traceability_unsupported"}, {"type": "assessed_by", "from": "sp_out", "to": "ga_1_overconfidence_gap"}, {"type": "assessed_by", "from": "sp_out", "to": "ga_2_speculative_scope"}, {"type": "assessed_by", "from": "sp_out", "to": "ga_3_composition_integrity"}], "nulls": {"claims": {"reason": "a_committed_scalar_value_has_no_textual_response_to_decompose"}, "inference.configuration": {"reason": "stub_graph_execution_captures_no_runtime_config"}}, "ext": {"klm_l1": {"retrieval_relevance": null, "claim_support": null, "evidence_coverage": null, "source_authority": null, "source_freshness": null, "formulas": {"claim_support": "klm-support-lexical/0.1", "aggregate": "klm-l1-aggregate/0.1"}, "signal_status": {"retrieval_relevance": "unavailable", "claim_support": "unavailable", "evidence_coverage": "unavailable", "source_authority": "unavailable", "source_freshness": "unavailable"}, "nulls": {"retrieval_relevance": {"reason": "graph_commit_is_not_a_retrieval"}, "claim_support": {"reason": "no_evidence_content_to_score_against"}, "evidence_coverage": {"reason": "no_decomposed_claims"}, "source_authority": {"reason": "tool_result_class_recorded_on_the_knowledge_units"}, "source_freshness": {"reason": "input_timestamps_not_propagated_in_stub"}}}}}
