{
 "schema": "klm-attestation/0.1",
 "inference": {
  "id": "aud_c7lEdStaoM2XtrCD3YYVtQ",
  "timestamp": "2026-07-31T04:11:53Z",
  "model": {
   "identifier": "nm/fehm",
   "version": "0.6.0"
  },
  "configuration": {
   "inference_mode": "top_k"
  },
  "request_scope": {
   "tenant_id": "REDACTED-FOR-PUBLICATION"
  }
 },
 "knowledge_contributions": [
  {
   "id": "ku_parametric",
   "content": "Parametric contribution (nm/fehm): CORTEX/data, CORTEX/eval, CORTEX/ml, CORTEX/planning, CORTEX/reasoning, FEHM/ar, FEHM/de, FEHM/en, FEHM/es, FEHM/fr, FEHM/ja, FEHM/tr, FEHM/zh, MING/py, MING/ts",
   "origin": "parametric",
   "function": "declarative",
   "source_reference": null,
   "source_class": null,
   "epistemic_status": "measured"
  }
 ],
 "evidence": [],
 "claims": [
  {
   "id": "cl_0",
   "text": "STEMMA, Nage AI tarafından geliştirilen bir end-to-end bilgi akış mimarisi; Fehm'ı oluşturan beş farklı model ailesini çapraz-atamalı şekilde birleştiren bir framework'dür.",
   "text_span": {
    "start": 0,
    "end": 172
   },
   "support_status": "unknown",
   "support_score": null
  }
 ],
 "procedures": [
  {
   "id": "pr_mark_unsupported_for_review",
   "trigger": "any(claim.support_status == 'unsupported')",
   "trigger_result": false,
   "activation_status": "not_activated",
   "affected_spans": []
  }
 ],
 "spans": [
  {
   "id": "sp_out",
   "start": 0,
   "end": 172
  },
  {
   "id": "sp_cl_0",
   "start": 0,
   "end": 172
  }
 ],
 "metacognition": {
  "declared_confidence": 0.3047,
  "grounded_confidence": {
   "formula": "klm-grounded/1.0",
   "value": 0.7009,
   "components": {
    "evidence": 1.0,
    "coherence": 0.1027
   }
  },
  "gap": -0.3962,
  "signal_status": {
   "declared_confidence": "heuristic",
   "grounded_confidence": "measured"
  }
 },
 "governance": {
  "engine": {
   "identifier": "nage-governance-deterministic",
   "version": "0.1.0"
  },
  "policies": [
   {
    "id": "pol_traceability_unsupported",
    "version": "1.0",
    "jurisdiction": "EU",
    "effective_date": "2025-08-01",
    "source": "EU AI Act (2024/1689) Art. 13 — per-decision traceability"
   },
   {
    "id": "pol_overconfidence_gap",
    "version": "1.0",
    "jurisdiction": null,
    "effective_date": null,
    "source": "KLM Spec 7.1 — declared/grounded gap discipline"
   },
   {
    "id": "pol_speculative_scope",
    "version": "1.0",
    "jurisdiction": null,
    "effective_date": null,
    "source": "KLM-Gamma-Unification D1 — SPECULATIVE label semantics"
   }
  ],
  "assessments": [
   {
    "id": "ga_0_traceability_unsupported",
    "namespace": "regulatory",
    "policy_id": "pol_traceability_unsupported",
    "policy_version": "1.0",
    "status": "unknown",
    "responsible_object": "sp_out",
    "evidence": "no gradeable claims",
    "epistemic_status": "measured"
   },
   {
    "id": "ga_1_overconfidence_gap",
    "namespace": "safety",
    "policy_id": "pol_overconfidence_gap",
    "policy_version": "1.0",
    "status": "pass",
    "responsible_object": "sp_out",
    "evidence": "confidence_gap=-0.3962 (max +0.3)",
    "epistemic_status": "measured"
   },
   {
    "id": "ga_2_speculative_scope",
    "namespace": "scope",
    "policy_id": "pol_speculative_scope",
    "policy_version": "1.0",
    "status": "pass",
    "responsible_object": "ku_parametric",
    "evidence": "epistemic_label=CONTESTED",
    "epistemic_status": "measured"
   }
  ]
 },
 "gamma": {
  "schema": "klm-gamma/1.0",
  "label_formula": "klm-label/1.0",
  "evidence_score": 1.0,
  "freshness_score": null,
  "coherence_score": 0.1027,
  "declared_confidence": 0.3047,
  "grounded_confidence": {
   "formula": "klm-grounded/1.0",
   "value": 0.7009,
   "components": {
    "evidence": 1.0,
    "coherence": 0.1027
   }
  },
  "confidence_gap": -0.3962,
  "confidence": 0.3047,
  "signal_status": {
   "evidence_score": "measured",
   "coherence_score": "measured",
   "freshness_score": "unavailable",
   "declared_confidence": "heuristic",
   "grounded_confidence": "measured"
  },
  "epistemic_label": "CONTESTED",
  "warning": "Birden fazla kaynak çelişiyor",
  "dominant_source": "varve/FEHM/tr",
  "provenance_map": {
   "facies": 0.0,
   "varve/FEHM/tr": 0.3047,
   "varve/FEHM/ja": 0.0719,
   "varve/CORTEX/data": 0.0648,
   "varve/FEHM/zh": 0.0644,
   "varve/CORTEX/ml": 0.0597,
   "varve/CORTEX/eval": 0.05,
   "varve/FEHM/fr": 0.0488,
   "varve/FEHM/es": 0.0484
  },
  "nulls": {
   "freshness_score": {
    "reason": "no_varve_age_metadata"
   }
  }
 },
 "relations": [
  {
   "type": "expressed_as",
   "from": "cl_0",
   "to": "sp_cl_0"
  },
  {
   "type": "assessed_by",
   "from": "sp_out",
   "to": "ga_0_traceability_unsupported"
  },
  {
   "type": "assessed_by",
   "from": "sp_out",
   "to": "ga_1_overconfidence_gap"
  },
  {
   "type": "assessed_by",
   "from": "ku_parametric",
   "to": "ga_2_speculative_scope"
  }
 ],
 "nulls": {
  "epsilon": {
   "reason": "no_power_measurement_available"
  }
 },
 "ext": {
  "klm_l1": {
   "retrieval_relevance": null,
   "claim_support": null,
   "evidence_coverage": null,
   "source_authority": null,
   "source_freshness": null,
   "formulas": {
    "claim_support": "klm-support-lexical/0.1",
    "aggregate": "klm-l1-aggregate/0.1"
   },
   "signal_status": {
    "retrieval_relevance": "unavailable",
    "claim_support": "unavailable",
    "evidence_coverage": "unavailable",
    "source_authority": "unavailable",
    "source_freshness": "unavailable"
   },
   "nulls": {
    "retrieval_relevance": {
     "reason": "no_retrieval_scores_recorded"
    },
    "claim_support": {
     "reason": "no_evidence_content_to_score_against"
    },
    "evidence_coverage": {
     "reason": "no_gradeable_claims"
    },
    "source_authority": {
     "reason": "no_classified_sources"
    },
    "source_freshness": {
     "reason": "source_publication_dates_not_available"
    }
   }
  },
  "review_queue": []
 }
}