{"schema": "klm-attestation/0.1", "inference": {"id": "outcrop_fault_sig_sealed01", "timestamp": "2024-10-27T03:33:20Z", "model": {"identifier": "nage-outcrop-min", "version": "0.2.0"}}, "knowledge_contributions": [{"id": "ku_fault_detection", "content": "Surveyor detected gamma_content_drift (outcrop://fault/sig_sealed01)", "origin": "injected", "function": "declarative", "source_reference": "outcrop://fault/sig_sealed01", "source_class": "tool_result", "lifecycle": "active", "epistemic_status": "measured"}], "evidence": [], "claims": [], "procedures": [], "spans": [{"id": "sp_out", "start": 0, "end": 0}], "metacognition": {"declared_confidence": 0.9, "grounded_confidence": {"formula": "klm-grounded/1.0", "value": 0.864665, "components": {"evidence": 0.864665}}, "gap": 0.035335, "signal_status": {"declared_confidence": "heuristic", "grounded_confidence": "measured"}}, "governance": {"engine": {"identifier": "outcrop-governance-deterministic", "version": "0.1.0"}, "policies": [{"id": "pol_traceability_unsupported", "version": "1.0", "jurisdiction": "EU", "effective_date": "2025-08-01", "source": "EU AI Act (2024/1689) Art. 13 \u2014 per-decision traceability"}, {"id": "pol_overconfidence_gap", "version": "1.0", "jurisdiction": null, "effective_date": null, "source": "KLM Spec \u00a77.1 \u2014 declared/grounded gap discipline"}, {"id": "pol_speculative_scope", "version": "1.0", "jurisdiction": null, "effective_date": null, "source": "KLM-Gamma-Unification D1 \u2014 SPECULATIVE label semantics"}], "assessments": [{"id": "ga_0_traceability_unsupported", "namespace": "regulatory", "policy_id": "pol_traceability_unsupported", "policy_version": "1.0", "status": "pass", "responsible_object": "ku_fault_detection", "evidence": "resolvable source_reference=outcrop://fault/sig_sealed01", "epistemic_status": "measured"}, {"id": "ga_1_overconfidence_gap", "namespace": "safety", "policy_id": "pol_overconfidence_gap", "policy_version": "1.0", "status": "pass", "responsible_object": "sp_out", "evidence": "confidence_gap=0.0353 (max +0.3)", "epistemic_status": "measured"}, {"id": "ga_2_speculative_scope", "namespace": "scope", "policy_id": "pol_speculative_scope", "policy_version": "1.0", "status": "pass", "responsible_object": "ku_fault_detection", "evidence": "epistemic_label=PROBABLE", "epistemic_status": "measured"}]}, "gamma": {"schema": "klm-gamma/1.0", "label_formula": "klm-label/1.0", "evidence_score": 0.864665, "freshness_score": null, "coherence_score": null, "declared_confidence": 0.9, "grounded_confidence": {"formula": "klm-grounded/1.0", "value": 0.864665, "components": {"evidence": 0.864665}}, "confidence_gap": 0.035335, "confidence": 0.9, "signal_status": {"evidence_score": "measured", "declared_confidence": "heuristic", "grounded_confidence": "measured"}, "nulls": {"coherence_score": {"reason": "single_surveyor_per_fault_type_in_d1_stub_no_cross_corroboration"}, "freshness_score": {"reason": "event_window_freshness_not_scored_in_stub"}}, "epistemic_label": "PROBABLE"}, "relations": [{"type": "assessed_by", "from": "ku_fault_detection", "to": "ga_0_traceability_unsupported"}, {"type": "assessed_by", "from": "sp_out", "to": "ga_1_overconfidence_gap"}, {"type": "assessed_by", "from": "ku_fault_detection", "to": "ga_2_speculative_scope"}], "nulls": {"claims": {"reason": "fault_summary_not_decomposed_into_gradeable_subclaims_in_d1_stub"}, "inference.configuration": {"reason": "stub_survey_captures_no_runtime_config"}}, "ext": {"klm_l1": {"retrieval_relevance": null, "claim_support": null, "evidence_coverage": null, "source_authority": null, "source_freshness": null, "formulas": {"claim_support": "klm-support-lexical/0.1", "aggregate": "klm-l1-aggregate/0.1"}, "signal_status": {"retrieval_relevance": "unavailable", "claim_support": "unavailable", "evidence_coverage": "unavailable", "source_authority": "unavailable", "source_freshness": "unavailable"}, "nulls": {"retrieval_relevance": {"reason": "survey_detection_is_not_a_retrieval"}, "claim_support": {"reason": "no_evidence_content_to_score_against"}, "evidence_coverage": {"reason": "no_decomposed_claims"}, "source_authority": {"reason": "tool_result_class_recorded_on_the_knowledge_unit"}, "source_freshness": {"reason": "event_window_freshness_not_scored_in_stub"}}}}}
